{
  "$schema": "./spec.schema.json",
  "name": "Glassmorphism",
  "id": "glass",
  "version": "1.0",
  "author": "bAInder",
  "description": "Frosted-glass panels on a deep blue gradient.",
  "variables": {
    "--primary":           "#6d9eff",
    "--primary-hover":     "#5b8bff",
    "--primary-light":     "rgba(109, 158, 255, 0.2)",
    "--primary-dark":      "#3b6bdd",

    "--header-bg":         "rgba(255, 255, 255, 0.10)",
    "--header-accent":     "rgba(109, 158, 255, 0.7)",

    "--bg-primary":        "rgba(255, 255, 255, 0.06)",
    "--bg-secondary":      "rgba(255, 255, 255, 0.10)",
    "--bg-tertiary":       "rgba(255, 255, 255, 0.14)",
    "--bg-elevated":       "rgba(255, 255, 255, 0.12)",
    "--bg-hover":          "rgba(255, 255, 255, 0.16)",
    "--bg-active":         "rgba(255, 255, 255, 0.22)",

    "--border-primary":    "rgba(255, 255, 255, 0.18)",
    "--border-secondary":  "rgba(255, 255, 255, 0.30)",
    "--border-focus":      "rgba(109, 158, 255, 0.8)",

    "--text-primary":      "rgba(255, 255, 255, 0.95)",
    "--text-secondary":    "rgba(255, 255, 255, 0.70)",
    "--text-tertiary":     "rgba(255, 255, 255, 0.45)",
    "--text-inverse":      "#0b0e1a",

    "--success":           "#5af7a0",
    "--success-bg":        "rgba(90, 247, 160, 0.12)",
    "--warning":           "#ffd166",
    "--warning-bg":        "rgba(255, 209, 102, 0.12)",
    "--danger":            "#ff7b7b",
    "--danger-bg":         "rgba(255, 123, 123, 0.12)",
    "--info":              "#6d9eff",
    "--info-bg":           "rgba(109, 158, 255, 0.12)",

    "--shadow-sm":         "0 2px 8px rgba(0, 0, 0, 0.25)",
    "--shadow-md":         "0 8px 24px rgba(0, 0, 0, 0.30)",
    "--shadow-lg":         "0 16px 40px rgba(0, 0, 0, 0.35)",
    "--shadow-xl":         "0 24px 56px rgba(0, 0, 0, 0.40)",

    "--overlay":           "rgba(0, 0, 0, 0.55)",
    "--overlay-light":     "rgba(255, 255, 255, 0.06)"
  }
}
