{
  "$schema": "./spec.schema.json",
  "name": "Light",
  "id": "light",
  "version": "1.0",
  "author": "bAInder",
  "description": "Clean white theme with indigo accents.",
  "variables": {
    "--primary":           "#6366f1",
    "--primary-hover":     "#4f46e5",
    "--primary-light":     "#e0e7ff",
    "--primary-dark":      "#3730a3",

    "--header-bg":         "linear-gradient(135deg, #eef0ff 0%, #ffffff 55%)",
    "--header-accent":     "#6366f1",

    "--bg-primary":        "#ffffff",
    "--bg-secondary":      "#f8fafc",
    "--bg-tertiary":       "#f1f5f9",
    "--bg-elevated":       "#ffffff",
    "--bg-hover":          "#f1f5f9",
    "--bg-active":         "#e2e8f0",

    "--border-primary":    "#e2e8f0",
    "--border-secondary":  "#cbd5e1",
    "--border-focus":      "#6366f1",

    "--text-primary":      "#0f172a",
    "--text-secondary":    "#475569",
    "--text-tertiary":     "#94a3b8",
    "--text-inverse":      "#ffffff",

    "--success":           "#10b981",
    "--success-bg":        "#d1fae5",
    "--warning":           "#f59e0b",
    "--warning-bg":        "#fef3c7",
    "--danger":            "#ef4444",
    "--danger-bg":         "#fee2e2",
    "--info":              "#3b82f6",
    "--info-bg":           "#dbeafe",

    "--shadow-sm":         "0 1px 2px 0 rgba(0, 0, 0, 0.05)",
    "--shadow-md":         "0 4px 6px -1px rgba(0, 0, 0, 0.1), 0 2px 4px -1px rgba(0, 0, 0, 0.06)",
    "--shadow-lg":         "0 10px 15px -3px rgba(0, 0, 0, 0.1), 0 4px 6px -2px rgba(0, 0, 0, 0.05)",
    "--shadow-xl":         "0 20px 25px -5px rgba(0, 0, 0, 0.1), 0 10px 10px -5px rgba(0, 0, 0, 0.04)",

    "--overlay":           "rgba(15, 23, 42, 0.5)",
    "--overlay-light":     "rgba(15, 23, 42, 0.1)"
  }
}
